[
  {
    "id": "J001",
    "category": "A_anonymous",
    "title": "Главная страница загружается и отображает ключевой контент",
    "actor": "anonymous",
    "starting_url": "/",
    "intent": "Посетитель открывает главную страницу сайта AURVA, чтобы понять, что это за организация и чем она занимается.",
    "expected_observations": [
      "Страница имеет заголовок, содержащий «AURVA» и «Ассоциация Участников Рынка Виртуальных Активов»",
      "Видно логотип AURVA в шапке навигации",
      "Видно главный заголовок h1 «Ассоциация Участников Рынка Виртуальных Активов.»",
      "Видно подзаголовок «ОБЪЕДИНЯЕМ ЛИДЕРОВ ИНДУСТРИИ В КЫРГЫЗСТАНЕ»",
      "Видна кнопка (или ссылка) «Подать заявку»",
      "Видна ссылка «Изучить манифест»",
      "Видна отметка «Основана в 2024 году»"
    ]
  },
  {
    "id": "J002",
    "category": "A_anonymous",
    "title": "Навигация десктоп — все ссылки в меню видны и кликабельны",
    "actor": "anonymous",
    "starting_url": "/",
    "intent": "Посетитель на десктопе изучает навигационное меню и убеждается, что основные разделы доступны.",
    "viewport": { "width": 1280, "height": 800 },
    "expected_observations": [
      "В навигационной панели видны ссылки «О нас», «Направления», «Преимущества», «Новости»",
      "В навигационной панели видна ссылка «Кабинет»",
      "В навигационной панели видна кнопка «Подать заявку»",
      "Клик на «О нас» открывает страницу с заголовком «О нас — AURVA»",
      "На странице «О нас» видны навигационные ссылки «О нас», «Направления», «Преимущества», «Новости»"
    ]
  },
  {
    "id": "J003",
    "category": "A_anonymous",
    "title": "Мобильная навигация — гамбургер-меню открывается и закрывается",
    "actor": "anonymous",
    "starting_url": "/",
    "intent": "Пользователь на мобильном устройстве открывает меню через кнопку-гамбургер, проверяет список разделов.",
    "viewport": { "width": 390, "height": 844 },
    "expected_observations": [
      "Кнопка «Открыть меню» (гамбургер) видна в шапке",
      "После нажатия гамбургера раскрывается мобильное меню",
      "В мобильном меню видны ссылки «О нас», «Направления», «Преимущества», «Новости»",
      "В мобильном меню видна ссылка «Личный кабинет»",
      "В мобильном меню видна ссылка «Подать заявку»",
      "После клика по ссылке меню закрывается"
    ]
  },
  {
    "id": "J004",
    "category": "A_anonymous",
    "title": "Главная страница — секции «О нас», «Направления», «Преимущества» видны при прокрутке",
    "actor": "anonymous",
    "starting_url": "/",
    "intent": "Посетитель прокручивает главную страницу вниз и проверяет, что ключевые секции отображаются с корректным содержимым.",
    "expected_observations": [
      "Видна секция с заголовком «Двигатель прогресса» / «ЦИФРОВОЙ ЭКОНОМИКИ»",
      "Видны описание AURVA как «независимая платформа» и упоминание «Кыргызской Республики»",
      "Видна секция «Направления → Работы» с четырьмя карточками: «Развитие и поддержка», «Регулирование», «Образование», «Инновации»",
      "Видна секция «Почему стоит → ВСТУПИТЬ» с четырьмя блоками: «Нетворкинг с лидерами», «Влияние на законы», «Образование», «Продвижение»",
      "Видна секция «Участники Ассоциации.» с карусельными карточками участников"
    ]
  },
  {
    "id": "J005",
    "category": "A_anonymous",
    "title": "Главная страница — блок участников и новости видны при прокрутке",
    "actor": "anonymous",
    "starting_url": "/",
    "intent": "Посетитель прокручивает главную страницу до разделов «Участники» и «Новости», чтобы убедиться в наличии актуального контента.",
    "expected_observations": [
      "Видна секция «Участники Ассоциации.» с хотя бы одним логотипом участника (например, «BitHub», «Envoys», «KLN», «Royal Inc.», «WeChange»)",
      "Видна секция «Последние → СОБЫТИЯ»",
      "Видно не менее трёх карточек новостей с заголовками и датами",
      "Видна ссылка «Все новости»"
    ]
  },
  {
    "id": "J006",
    "category": "A_anonymous",
    "title": "Главная страница — контактная форма и контактные данные видны",
    "actor": "anonymous",
    "starting_url": "/",
    "intent": "Посетитель прокручивает страницу до раздела контактов, чтобы найти адрес и способ связи.",
    "expected_observations": [
      "Видна секция с заголовком «Свяжитесь с нами.»",
      "Виден адрес «Кыргызская Республика, г. Бишкек»",
      "Виден телефон «+996 550 99 90 10»",
      "Виден email «aurva.kg@gmail.com»",
      "Видна форма с полем «Название компании / Имя» и полем «Контактный телефон»",
      "Видна кнопка «Оставить заявку»"
    ]
  },
  {
    "id": "J007",
    "category": "A_anonymous",
    "title": "Страница «О нас» — полное содержимое загружается",
    "actor": "anonymous",
    "starting_url": "/about",
    "intent": "Посетитель открывает страницу «О нас», чтобы узнать миссию, ценности и структуру управления ассоциации.",
    "expected_observations": [
      "Заголовок страницы содержит «О нас — AURVA»",
      "Виден главный заголовок «Формируем будущее Цифровой Экономики.»",
      "Видна секция «Наша миссия И видение» с подзаголовками «Миссия» и «Видение»",
      "Видна секция «Цели и Приоритеты» с карточками, включая «Совершенствование законодательства», «Защита интересов участников»",
      "Видна секция «Наши → ЦЕННОСТИ» с блоками «Прозрачность», «Безопасность», «Инновационность», «Сотрудничество»",
      "Видна секция «Структура Управления» с именем «Темир Казыбай» (Председатель Ассоциации)",
      "Видна секция «Наши Партнеры»"
    ]
  },
  {
    "id": "J008",
    "category": "A_anonymous",
    "title": "Страница новостей — список новостей загружается и отображает статьи",
    "actor": "anonymous",
    "starting_url": "/news",
    "intent": "Посетитель переходит на страницу всех новостей, чтобы просмотреть актуальные публикации ассоциации.",
    "expected_observations": [
      "Заголовок страницы содержит «Новости — AURVA»",
      "Виден главный заголовок «Все → НОВОСТИ»",
      "Видны карточки новостей с заголовками, датами и фрагментами текста",
      "Видна ссылка «На главную» в шапке страницы",
      "Каждая карточка новости содержит слово «Читать»"
    ]
  },
  {
    "id": "J009",
    "category": "A_anonymous",
    "title": "Детальная страница новости — открывается из списка и отображает полный текст",
    "actor": "anonymous",
    "starting_url": "/news",
    "intent": "Посетитель кликает на карточку новости со страницы списка новостей и читает её полный текст.",
    "expected_observations": [
      "После клика на карточку новости открывается детальная страница",
      "Заголовок статьи виден как h1 на странице",
      "Видна дата публикации в формате «дд месяц гггг г.»",
      "Виден полный текст статьи",
      "Видна ссылка «Все новости» для возврата к списку",
      "Видны кнопки/ссылки «Поделиться»"
    ]
  },
  {
    "id": "J010",
    "category": "A_anonymous",
    "title": "Страница курсов загружается и отображает навигацию",
    "actor": "anonymous",
    "starting_url": "/courses",
    "intent": "Посетитель открывает страницу курсов, чтобы узнать об образовательных программах ассоциации.",
    "expected_observations": [
      "Заголовок страницы содержит «Курсы — AURVA»",
      "Видна навигационная шапка с логотипом AURVA и ссылками «Главная», «О нас», «Новости», «Курсы», «Кабинет»",
      "Страница не показывает ошибку сервера"
    ],
    "skip_if": "Курсы не отображаются без авторизации (страница может требовать входа для просмотра содержимого)"
  },
  {
    "id": "J011",
    "category": "A_anonymous",
    "title": "Личный кабинет перенаправляет на форму входа",
    "actor": "anonymous",
    "starting_url": "/cabinet",
    "intent": "Неавторизованный пользователь пытается открыть личный кабинет и ожидает увидеть форму входа.",
    "expected_observations": [
      "Пользователь перенаправляется на страницу входа",
      "Виден заголовок «Вход в кабинет»",
      "Видна форма с полями Email и Пароль",
      "Видна кнопка «Войти»",
      "Видна ссылка «Зарегистрироваться»"
    ]
  },
  {
    "id": "J012",
    "category": "A_anonymous",
    "title": "Футер отображает копирайт, навигацию и правовые ссылки",
    "actor": "anonymous",
    "starting_url": "/",
    "intent": "Посетитель прокручивает страницу до подвала, чтобы найти дополнительные ссылки и информацию об организации.",
    "expected_observations": [
      "Виден футер с логотипом AURVA",
      "Видна надпись «Ассоциация активна» с анимированным индикатором",
      "Видны навигационные ссылки в футере: «О нас», «Направления», «Преимущества», «Участники», «Новости»",
      "Видны ссылки «Политика конфиденциальности» и «Устав»",
      "Видна строка копирайта «© 2024 Ассоциация Участников Рынка Виртуальных Активов»"
    ]
  },
  {
    "id": "J013",
    "category": "D_edge",
    "title": "Несуществующий URL — сервер возвращает ответ об ошибке",
    "actor": "anonymous",
    "starting_url": "/nonexistent-page-xyz",
    "intent": "Посетитель случайно открывает несуществующий адрес и видит, что сервер обрабатывает такой запрос (ответ об ошибке вместо зависания).",
    "negative": true,
    "expected_observations": [
      "Страница не зависает и не показывает технической ошибки браузера",
      "Сервер возвращает какой-либо ответ (JSON-ошибку или страницу 404) с указанием на ошибку «Cannot GET» или аналогичным"
    ]
  },
  {
    "id": "J014",
    "category": "D_edge",
    "title": "Панель администратора закрыта для неавторизованных — показывает форму входа",
    "actor": "anonymous",
    "starting_url": "/admin/login",
    "intent": "Анонимный пользователь пытается открыть панель администрирования и ожидает увидеть экран входа, а не содержимое панели.",
    "expected_observations": [
      "Открывается страница входа (login) с заголовком «Админ-панель» или «Вход в систему»",
      "Видны поля Email и Пароль",
      "Видна кнопка «Войти»",
      "Содержимое административной панели (дашборд, список новостей, список участников и т.п.) не отображается"
    ],
    "probe_path": "/admin/login"
  }
]
